{
  "certificate": {
    "all_pass": true,
    "ell15_truncation": {
      "all_pass": true,
      "alternating_product_depth": 8,
      "binary_safety_pass": true,
      "binary_same_parity_case_count": 512,
      "first_integer_index_of_divergence": 17,
      "narrow_stateless_minimality": {
        "greedy_current_outputs": [
          1,
          -1
        ],
        "input_class": "all same-parity sigma-runs have length at most eight",
        "last_fourteen_symbols_equal": true,
        "minimum_contiguous_window_length": 15,
        "run_lengths": [
          7,
          8
        ],
        "scope": "q=1 causal contiguous stateless exact-stream realization"
      },
      "not_nine_consecutive_integers": true,
      "run_behavior_pass": true,
      "same_parity_recursive_outputs": [
        1,
        -1,
        1,
        -1,
        1,
        -1,
        1,
        -1,
        1
      ],
      "same_parity_sigma_site_count": 9,
      "same_parity_window_outputs": [
        1,
        -1,
        1,
        -1,
        1,
        -1,
        1,
        -1,
        -1
      ],
      "synthetic_prefix_length": 17,
      "window_length": 15
    },
    "exhaustive_prefix_extrema": {
      "all_pass": true,
      "by_length": [
        {
          "length": 1,
          "word_count": 3
        },
        {
          "length": 2,
          "word_count": 9
        },
        {
          "length": 3,
          "word_count": 27
        },
        {
          "length": 4,
          "word_count": 81
        },
        {
          "length": 5,
          "word_count": 243
        },
        {
          "length": 6,
          "word_count": 729
        },
        {
          "length": 7,
          "word_count": 2187
        },
        {
          "length": 8,
          "word_count": 6561
        },
        {
          "length": 9,
          "word_count": 19683
        },
        {
          "length": 10,
          "word_count": 59049
        }
      ],
      "extrema_equality_count": 177144,
      "maximum_length": 10,
      "word_count": 88572
    },
    "graph_lift_safety": {
      "all_pass": true,
      "cases_per_witness": 243,
      "rows": [
        {
          "cases": 243,
          "name": "unconditional",
          "plus_edges": [
            [
              0,
              1
            ]
          ],
          "safe": true
        },
        {
          "cases": 243,
          "name": "conditional",
          "plus_edges": [
            [
              -1,
              1
            ],
            [
              0,
              1
            ]
          ],
          "safe": true
        }
      ],
      "total_cases": 486,
      "witness_count": 2
    },
    "lag_two_census": {
      "ab_multiplicities": [
        {
          "c02": "-1",
          "c11": "0",
          "count": 1
        },
        {
          "c02": "-1",
          "c11": "1/2",
          "count": 1
        },
        {
          "c02": "0",
          "c11": "-1/2",
          "count": 2
        },
        {
          "c02": "0",
          "c11": "0",
          "count": 5
        },
        {
          "c02": "0",
          "c11": "1/2",
          "count": 2
        },
        {
          "c02": "1",
          "c11": "-1/2",
          "count": 1
        },
        {
          "c02": "1",
          "c11": "0",
          "count": 1
        }
      ],
      "all_pass": true,
      "c11_nonzero_count": 6,
      "c11_zero_count": 7,
      "coefficient_multiplicity_histogram": {
        "1": 5,
        "2": 2,
        "4": 1
      },
      "coefficient_order": [
        "c01",
        "c02",
        "c11",
        "c12",
        "c21",
        "c22"
      ],
      "coefficient_rank": 5,
      "coefficient_vector_multiplicities": [
        1,
        1,
        1,
        1,
        1,
        2,
        2,
        4
      ],
      "conditional_witness": [
        [
          -1,
          1
        ],
        [
          0,
          1
        ]
      ],
      "conditional_witness_coefficients": [
        "0",
        "1",
        "-1/2",
        "-1/2",
        "-1/2",
        "-1/2"
      ],
      "distinct_coefficient_vector_count": 8,
      "relation_pass": true,
      "safe_size_histogram": {
        "0": 1,
        "1": 6,
        "2": 6
      },
      "safe_table_count": 13,
      "tables": [
        {
          "c02": "0",
          "c11": "0",
          "coefficients": [
            "-1",
            "0",
            "0",
            "0",
            "0",
            "0"
          ],
          "plus_edges": []
        },
        {
          "c02": "0",
          "c11": "0",
          "coefficients": [
            "-1",
            "0",
            "0",
            "0",
            "0",
            "0"
          ],
          "plus_edges": [
            [
              -1,
              0
            ]
          ]
        },
        {
          "c02": "0",
          "c11": "-1/2",
          "coefficients": [
            "-1",
            "0",
            "-1/2",
            "-1/2",
            "1/2",
            "1/2"
          ],
          "plus_edges": [
            [
              -1,
              1
            ]
          ]
        },
        {
          "c02": "0",
          "c11": "-1/2",
          "coefficients": [
            "-1",
            "0",
            "-1/2",
            "-1/2",
            "1/2",
            "1/2"
          ],
          "plus_edges": [
            [
              -1,
              0
            ],
            [
              -1,
              1
            ]
          ]
        },
        {
          "c02": "-1",
          "c11": "0",
          "coefficients": [
            "0",
            "-1",
            "0",
            "0",
            "-1",
            "1"
          ],
          "plus_edges": [
            [
              0,
              -1
            ]
          ]
        },
        {
          "c02": "1",
          "c11": "0",
          "coefficients": [
            "0",
            "1",
            "0",
            "0",
            "-1",
            "-1"
          ],
          "plus_edges": [
            [
              0,
              1
            ]
          ]
        },
        {
          "c02": "1",
          "c11": "-1/2",
          "coefficients": [
            "0",
            "1",
            "-1/2",
            "-1/2",
            "-1/2",
            "-1/2"
          ],
          "plus_edges": [
            [
              -1,
              1
            ],
            [
              0,
              1
            ]
          ]
        },
        {
          "c02": "0",
          "c11": "0",
          "coefficients": [
            "1",
            "0",
            "0",
            "0",
            "-2",
            "0"
          ],
          "plus_edges": [
            [
              0,
              -1
            ],
            [
              0,
              1
            ]
          ]
        },
        {
          "c02": "0",
          "c11": "1/2",
          "coefficients": [
            "-1",
            "0",
            "1/2",
            "-1/2",
            "1/2",
            "-1/2"
          ],
          "plus_edges": [
            [
              1,
              -1
            ]
          ]
        },
        {
          "c02": "-1",
          "c11": "1/2",
          "coefficients": [
            "0",
            "-1",
            "1/2",
            "-1/2",
            "-1/2",
            "1/2"
          ],
          "plus_edges": [
            [
              0,
              -1
            ],
            [
              1,
              -1
            ]
          ]
        },
        {
          "c02": "0",
          "c11": "0",
          "coefficients": [
            "-1",
            "0",
            "0",
            "0",
            "0",
            "0"
          ],
          "plus_edges": [
            [
              1,
              0
            ]
          ]
        },
        {
          "c02": "0",
          "c11": "0",
          "coefficients": [
            "-1",
            "0",
            "0",
            "0",
            "0",
            "0"
          ],
          "plus_edges": [
            [
              -1,
              0
            ],
            [
              1,
              0
            ]
          ]
        },
        {
          "c02": "0",
          "c11": "1/2",
          "coefficients": [
            "-1",
            "0",
            "1/2",
            "-1/2",
            "1/2",
            "-1/2"
          ],
          "plus_edges": [
            [
              1,
              -1
            ],
            [
              1,
              0
            ]
          ]
        }
      ],
      "total_table_count": 512,
      "two_edge_in_star_count": 3,
      "two_edge_out_star_count": 3,
      "unconditional_witness": [
        [
          0,
          1
        ]
      ],
      "unconditional_witness_coefficients": [
        "0",
        "1",
        "0",
        "0",
        "-1",
        "-1"
      ],
      "unique_linear_relation": "c22=-c02-c11"
    },
    "mobius_finite_reproduction": {
      "all_pass": true,
      "endpoint": 1048576,
      "finite_ledger_pass": true,
      "finite_not_asymptotic": true,
      "lag_ledger_all_prefixes_pass": true,
      "lag_ledger_prefix_count": 1048576,
      "no_same_parity_sigma_run_of_length_nine": {
        "-1": true,
        "1": true
      },
      "prefix_extrema_equality_count": 2097152,
      "recursive_window_equality_count": 2097152,
      "rows": [
        {
          "D2": -34,
          "K": 530,
          "M": -4,
          "N": 1024,
          "Q1": 624,
          "Q2": 330,
          "S0": 308,
          "Sh": 492,
          "Smax": 530,
          "Smin": -504,
          "U2": -18,
          "V2": -14
        },
        {
          "D2": 33,
          "K": 32320,
          "M": 14,
          "N": 65536,
          "Q1": 39844,
          "Q2": 21155,